{
  "contract_id": "SF-CON-NOTIFICATION-DISPATCH",
  "contract_status": "FROZEN",
  "freeze_status": "FROZEN",
  "tenant_id": "11111111-1111-4111-8111-111111111111",
  "dispatch_id": "55555555-5555-4555-8555-555555555555",
  "application_id": "33333333-3333-4333-8333-333333333333",
  "template_ref": "tpl.payment.received.v1",
  "channel": "SMS",
  "locale": "en-IN",
  "recipient_handle_class": "CITIZEN_HANDLE_REF",
  "recipient_handle_ref": "handle.citizen.demo.001",
  "connector_binding_id": "77777777-7777-4777-8777-777777777777",
  "connector_mode": "SIMULATED",
  "raw_pii_in_payload_forbidden": true,
  "simulation_marker_required_when_simulated": true,
  "idempotency_key": "notify-demo-001"
}
